{
  "schema_version": 1,
  "session_id": "11111111-1111-4111-8111-111111111111",
  "mode": "learning",
  "status": "completed",
  "created_at": "2026-07-17T14:00:00Z",
  "updated_at": "2026-07-17T14:02:00Z",
  "title": "How streaming transcription works",
  "retention": {
    "audio": "all",
    "marker_context_before_ms": 30000,
    "marker_context_after_ms": 30000
  },
  "stages": [
    {
      "stage_id": "22222222-2222-4222-8222-222222222222",
      "sequence": 1,
      "started_at": "2026-07-17T14:00:00Z",
      "ended_at": "2026-07-17T14:02:00Z",
      "status": "completed"
    }
  ]
}
